Speaker,Detail,WordsLen,UniqueWords,JLPTLevel,Sentiment-tabularisai,Sentiment-tabularisai-score,Sentiment-lxyuan,Sentiment-lxyuan-score,Sentiment-Christian,Sentiment-Christian-score
AI,こんにちは！健康やウェルビーイングについてお話ししましょう！最近、身体活動やリラクゼーションに取り組んでいますか？何か特別なことがありましたか？,72,30.0,2,Neutral,0.4224770069122314,positive,0.5704658627510071,positive,0.9986584186553956
User,今研究テーマを決めるのを悩んでいるんですが，どうすればいいですか．AIに興味があります,43,24.0,2,Neutral,0.3603993058204651,positive,0.5742733478546143,neutral,0.9785032868385316
AI,AIに興味をお持ちなんですね！素晴らしい選択ですね。AIは非常に幅広いトピックで研究できるので、興味や関心に合わせてテーマを選ぶことが重要です。以下はいくつかのアイデアです：1. **機械学習アルゴリズムの比較**: 異なる機械学習アルゴリズムの性能を比較し、その特性や適用範囲を調査する研究があります。2. **自然言語処理の応用**: テキストデータや音声データから情報を抽出するための自然言語処理技術の応用研究を行うことができます。3. **強化学習の応用**: 強化学習を使用して、自動運転車の制御やゲームプレイなど、様々な応用分野における問題を解決する研究があります。4. **AI倫理と社会への影響**: AI技術の倫理的な側面や社会への影響に焦点を当てた研究があります。これらのアイデアの中から、特に興味を引くものがありますか？また、他にも興味を持っているトピックがあれば教えてください！,401,112.0,2,Positive,0.3810648918151855,positive,0.8877714276313782,positive,0.6122938394546509
User,自分は自然言語処理に興味がありますねー．対話システムとかが面白そうです,35,18.0,2,Positive,0.4970182180404663,positive,0.545412003993988,positive,0.9679239988327026
AI,自然言語処理（NLP）と対話システムは確かに非常に面白い分野です！対話システムは、人間の言語を理解し、自然な会話を行うための技術を含んでいます。興味深いテーマがたくさんあります：対話システムの設計と開発、自然で流暢な対話を行うためのシステムを設計・開発する方法についての研究があります。これには、言語理解、意味解釈、返答生成などが含まれます。感情や個人性の反映、対話システムがユーザーとのコミュニケーションで感情や個人性を反映する方法についての研究があります。これにより、より人間らしい対話が可能になります。対話システムの評価方法、対話システムの品質や有用性を評価する方法についての研究があります。これには、人間との比較実験や客観的な評価指標の開発が含まれます。マルチモーダル対話システム、テキストだけでなく、音声や画像など、複数のモードを組み合わせた対話システムの研究もあります。興味深いテーマが見つかったら、それに関連する研究を探してみると良いでしょう。また、自分自身で新しいアイデアを探求することも可能です！,457,103.0,2,Positive,0.4581551253795624,positive,0.8086948394775391,positive,0.9425204992294312
User,それらのテーマの難易度とかは分かりますか？あまり知らないので,30,15.0,2,Very Negative,0.4404173493385315,negative,0.549795389175415,neutral,0.9960963129997252
AI,もちろんです！それぞれのテーマの難易度は異なりますが、以下のような一般的な目安があります：対話システムの設計と開発、初心者向けから上級者向けまで、幅広い難易度のプロジェクトがあります。初めてのプロジェクトとして、既存のツールやフレームワークを使用して基本的な対話システムを構築することから始めることができます。高度な機能や自然な対話を実現するには、言語処理や機械学習の知識が必要になるかもしれません。感情や個人性の反映、このテーマは、NLPや機械学習の基礎知識があると役立ちます。感情や個人性を反映させるためには、感情分析や文体分類などの技術を理解し、それを対話システムに統合する必要があります。対話システムの評価方法、評価方法の理解と実践は、対話システムの開発において非常に重要です。定量的な評価指標や質的な評価方法を使用して、システムの性能や有用性を評価するための技術を学ぶ必要があります。マルチモーダル対話システム、複数のモードを組み合わせた対話システムは、より高度な技術や知識が必要です。音声処理や画像処理、それに加えてテキスト処理の知識が必要になる可能性があります。どのテーマを選んでも、興味を持ち、少しずつ学びながら進めていくことが大切です。初めは簡単なプロジェクトから始めて、徐々に難易度を上げていくのが良いでしょう！,566,132.0,2,Neutral,0.5306722521781921,positive,0.8348854184150696,neutral,0.9914100766181946
User,なるほど，面白そうですね，また脳科学にも興味があるのですがどうでしょう,35,18.0,2,Positive,0.4203176200389862,positive,0.4374005794525146,positive,0.9971988201141356
AI,脳科学も非常に興味深い分野ですね！脳の仕組みや機能、そして心と身体の関係についての研究が行われています。脳科学の研究テーマには以下のようなものがあります：脳の構造と機能、 脳の異なる領域がどのような役割を果たしているのか、脳の構造と機能の関係を探求する研究があります。MRIやEEGなどの画像技術を使用して、脳の活動を観察することが一般的です。学習と記憶のメカニズム、学習や記憶が脳内でどのように処理されるのか、そのメカニズムを解明する研究があります。これには、シナプスの変化や神経回路の活動などが関わっています。脳の発達と変化、幼少期から老年期までの脳の発達や変化に関する研究があります。特に、発達障害や神経変性疾患などの疾患に焦点を当てた研究も行われています。脳と意識の関係、 脳の活動と意識の関係についての研究があります。意識のメカニズムや意識の変化に関する研究が含まれます。脳科学の研究は多岐にわたり、理解するのに多くの知識と技術が必要ですが、非常に興味深い分野です。興味を持っているなら、脳科学の研究に取り組むことで、人間の複雑な心と身体の関係について深く理解することができますよ！,496,107.0,2,Positive,0.3634935617446899,positive,0.8893457651138306,neutral,0.6037746071815491
User,なるほど，ありがとうございます．アニメで脳科学の内容があり面白かったんですよね,39,20.0,2,Very Positive,0.4880004227161407,positive,0.4367271661758423,positive,0.9991575479507446
AI,アニメで脳科学の内容が取り上げられることがあるんですね！脳科学の興味深さは、アニメや他のメディアでも人々に広く知られるようになってきています。アニメなどのエンターテインメントを通じて、科学や学問の面白さを伝えることができるのは素晴らしいことですね。もし興味があれば、アニメで脳科学の内容が取り上げられた作品を探してみるのも良いかもしれません。その作品を通じて、より深く脳科学について学ぶことができるかもしれませんし、楽しむこともできますよ！,220,66.0,2,Positive,0.4617847502231598,positive,0.9416006207466124,positive,0.9992444515228271
AI Average,Mean Unique Words,17,91.66666666666669,3,Neutral,0.4241121411323547,positive,0.5115834474563599,positive,0.9940897226333618
User Average,Mean Unique Words,17,19.0,3,Neutral,0.4241121411323547,positive,0.5115834474563599,positive,0.9940897226333618
